{
  "standardVersion": "3.0.0",
  "generatedAt": "2026-10-06T20:23:29+00:00",
  "source": {
    "strategy": "drupal-render-evidence",
    "root": "/fixture/Sites/PNCB/worktrees/pncb-2026-merge"
  },
  "items": {
    "block:basic": {
      "templates": [],
      "genericTemplate": "docroot/themes/custom/pncb/templates/block/block.html.twig",
      "sdc": [],
      "sdcDefinitions": [],
      "stylesheets": [],
      "styleFacts": {
        "rootRules": [],
        "partRules": [],
        "mediaQueries": 0
      },
      "rootClasses": [],
      "rootSdc": null,
      "referencedFields": [],
      "defects": [],
      "confidence": "low"
    },
    "block:betty_bot_nav_item": {
      "templates": [],
      "genericTemplate": "docroot/themes/custom/pncb/templates/block/block.html.twig",
      "sdc": [],
      "sdcDefinitions": [],
      "stylesheets": [],
      "styleFacts": {
        "rootRules": [],
        "partRules": [],
        "mediaQueries": 0
      },
      "rootClasses": [],
      "rootSdc": null,
      "referencedFields": [],
      "defects": [],
      "confidence": "low"
    },
    "block:contact_and_follow": {
      "templates": [
        "docroot/themes/custom/ipn/templates/block/block--contact-and-follow.html.twig"
      ],
      "genericTemplate": null,
      "sdc": [],
      "sdcDefinitions": [],
      "stylesheets": [],
      "styleFacts": {
        "rootRules": [],
        "partRules": [],
        "mediaQueries": 0
      },
      "rootClasses": [
        "footer-connect__contact",
        "footer-connect__follow",
        "share-module"
      ],
      "rootSdc": null,
      "referencedFields": [],
      "defects": [],
      "confidence": "medium"
    },
    "block:faces_of_certification": {
      "templates": [],
      "genericTemplate": "docroot/themes/custom/pncb/templates/block/block.html.twig",
      "sdc": [],
      "sdcDefinitions": [],
      "stylesheets": [
        "docroot/themes/custom/pncb/components/faces-of-certification/faces-of-certification.css"
      ],
      "styleFacts": {
        "rootRules": [],
        "partRules": [],
        "mediaQueries": 0
      },
      "rootClasses": [],
      "rootSdc": null,
      "referencedFields": [],
      "defects": [],
      "confidence": "low"
    },
    "block:footer_top_cta": {
      "templates": [],
      "genericTemplate": "docroot/themes/custom/pncb/templates/block/block.html.twig",
      "sdc": [],
      "sdcDefinitions": [],
      "stylesheets": [],
      "styleFacts": {
        "rootRules": [],
        "partRules": [],
        "mediaQueries": 0
      },
      "rootClasses": [],
      "rootSdc": null,
      "referencedFields": [],
      "defects": [],
      "confidence": "low"
    },
    "block:ipn_logo": {
      "templates": [],
      "genericTemplate": "docroot/themes/custom/pncb/templates/block/block.html.twig",
      "sdc": [],
      "sdcDefinitions": [],
      "stylesheets": [],
      "styleFacts": {
        "rootRules": [],
        "partRules": [],
        "mediaQueries": 0
      },
      "rootClasses": [],
      "rootSdc": null,
      "referencedFields": [],
      "defects": [],
      "confidence": "low"
    },
    "block:sidebar_promo": {
      "templates": [],
      "genericTemplate": "docroot/themes/custom/pncb/templates/block/block.html.twig",
      "sdc": [],
      "sdcDefinitions": [],
      "stylesheets": [],
      "styleFacts": {
        "rootRules": [],
        "partRules": [],
        "mediaQueries": 0
      },
      "rootClasses": [],
      "rootSdc": null,
      "referencedFields": [],
      "defects": [],
      "confidence": "low"
    },
    "block:site_copyright": {
      "templates": [],
      "genericTemplate": "docroot/themes/custom/pncb/templates/block/block.html.twig",
      "sdc": [],
      "sdcDefinitions": [],
      "stylesheets": [],
      "styleFacts": {
        "rootRules": [],
        "partRules": [],
        "mediaQueries": 0
      },
      "rootClasses": [],
      "rootSdc": null,
      "referencedFields": [],
      "defects": [],
      "confidence": "low"
    },
    "block:sitewide_alert": {
      "templates": [
        "docroot/themes/custom/ipn/templates/block/block--sitewide-alert.html.twig",
        "docroot/themes/custom/pncb/templates/block/block--sitewide-alert.html.twig"
      ],
      "genericTemplate": null,
      "sdc": [],
      "sdcDefinitions": [],
      "stylesheets": [],
      "styleFacts": {
        "rootRules": [],
        "partRules": [],
        "mediaQueries": 0
      },
      "rootClasses": [
        "c-message-bar__header",
        "c-message-bar__copy",
        "is-white"
      ],
      "rootSdc": null,
      "referencedFields": [],
      "defects": [],
      "confidence": "medium"
    },
    "paragraph:accordion": {
      "templates": [
        "docroot/themes/custom/pncb/templates/paragraphs/paragraph--accordion.html.twig"
      ],
      "genericTemplate": null,
      "sdc": [
        "pncb:heading",
        "pncb:accordion"
      ],
      "sdcDefinitions": [
        "docroot/themes/custom/pncb/components/heading/heading.component.yml",
        "docroot/themes/custom/pncb/components/accordion/accordion.component.yml"
      ],
      "stylesheets": [
        "docroot/themes/custom/pncb/components/accordion/accordion.css",
        "docroot/themes/custom/pncb/components/heading/heading.css"
      ],
      "styleFacts": {
        "rootRules": [],
        "partRules": [],
        "mediaQueries": 0
      },
      "rootClasses": [],
      "rootSdc": "pncb:accordion",
      "referencedFields": [
        "field_accordion_item",
        "field_header"
      ],
      "defects": [],
      "confidence": "high"
    },
    "paragraph:accordion_callout": {
      "templates": [
        "docroot/themes/custom/pncb/templates/paragraphs/paragraph--accordion-callout.html.twig"
      ],
      "genericTemplate": null,
      "sdc": [],
      "sdcDefinitions": [],
      "stylesheets": [],
      "styleFacts": {
        "rootRules": [],
        "partRules": [],
        "mediaQueries": 0
      },
      "rootClasses": [
        "pncb-legacy-cards"
      ],
      "rootSdc": null,
      "referencedFields": [
        "field_callout"
      ],
      "defects": [],
      "confidence": "medium"
    },
    "paragraph:accordion_item": {
      "templates": [
        "docroot/themes/custom/pncb/templates/paragraphs/paragraph--accordion-item.html.twig"
      ],
      "genericTemplate": null,
      "sdc": [
        "pncb:accordion-item",
        "pncb:prose"
      ],
      "sdcDefinitions": [
        "docroot/themes/custom/pncb/components/accordion-item/accordion-item.component.yml",
        "docroot/themes/custom/pncb/components/prose/prose.component.yml"
      ],
      "stylesheets": [
        "docroot/themes/custom/pncb/components/accordion-item/accordion-item.css",
        "docroot/themes/custom/pncb/components/prose/prose.css"
      ],
      "styleFacts": {
        "rootRules": [],
        "partRules": [],
        "mediaQueries": 0
      },
      "rootClasses": [],
      "rootSdc": "pncb:accordion-item",
      "referencedFields": [
        "field_accordion_body",
        "field_callouts_and_links"
      ],
      "defects": [],
      "confidence": "high"
    },
    "paragraph:accordion_links": {
      "templates": [
        "docroot/themes/custom/pncb/templates/paragraphs/paragraph--accordion-links.html.twig"
      ],
      "genericTemplate": null,
      "sdc": [],
      "sdcDefinitions": [],
      "stylesheets": [],
      "styleFacts": {
        "rootRules": [],
        "partRules": [],
        "mediaQueries": 0
      },
      "rootClasses": [
        "pncb-legacy-panel"
      ],
      "rootSdc": null,
      "referencedFields": [
        "field_links"
      ],
      "defects": [],
      "confidence": "medium"
    },
    "paragraph:betty_bot": {
      "templates": [
        "docroot/themes/custom/pncb/templates/paragraphs/paragraph--betty-bot.html.twig"
      ],
      "genericTemplate": null,
      "sdc": [
        "pncb:betty-bot"
      ],
      "sdcDefinitions": [
        "docroot/themes/custom/pncb/components/betty-bot/betty-bot.component.yml"
      ],
      "stylesheets": [
        "docroot/themes/custom/pncb/components/betty-bot/betty-bot.css"
      ],
      "styleFacts": {
        "rootRules": [],
        "partRules": [],
        "mediaQueries": 0
      },
      "rootClasses": [],
      "rootSdc": "pncb:betty-bot",
      "referencedFields": [
        "field_heading",
        "field_intro_text",
        "field_suggested_questions"
      ],
      "defects": [],
      "confidence": "high"
    },
    "paragraph:betty_bot_studyguide": {
      "templates": [
        "docroot/themes/custom/pncb/templates/paragraphs/paragraph--betty-bot-studyguide.html.twig"
      ],
      "genericTemplate": null,
      "sdc": [
        "pncb:betty-bot-studyguide"
      ],
      "sdcDefinitions": [
        "docroot/themes/custom/pncb/components/betty-bot-studyguide/betty-bot-studyguide.component.yml"
      ],
      "stylesheets": [
        "docroot/themes/custom/pncb/components/betty-bot-studyguide/betty-bot-studyguide.css"
      ],
      "styleFacts": {
        "rootRules": [],
        "partRules": [],
        "mediaQueries": 0
      },
      "rootClasses": [],
      "rootSdc": "pncb:betty-bot-studyguide",
      "referencedFields": [
        "field_destination_url",
        "field_eyebrow",
        "field_heading"
      ],
      "defects": [],
      "confidence": "high"
    },
    "paragraph:board_member_content": {
      "templates": [],
      "genericTemplate": "docroot/themes/custom/pncb/templates/paragraphs/paragraph.html.twig",
      "sdc": [],
      "sdcDefinitions": [],
      "stylesheets": [
        "docroot/themes/custom/pncb/components/board-member-content/board-member-content.css"
      ],
      "styleFacts": {
        "rootRules": [],
        "partRules": [],
        "mediaQueries": 0
      },
      "rootClasses": [],
      "rootSdc": null,
      "referencedFields": [
        "field_example"
      ],